startphrase,ending0,ending1,ending2,ending3,label
"Someone flinches as the German rounds shatter the windows. Manning the searchlight, Pleasant",chase someone towards the roof.,"explode the flamethrower, celery sprawling,.",turn uncertainly in a corner.,catches a bullet and collapses.,3
"Barefoot, someone is manhandled into one of the vehicles. The four suvs",throw themselves in the air.,begin to leave the store.,arrive at the possessed truck.,drive off in different directions.,3
He opens the door and sees her in her nightgown. He,watches and licks her lips.,is reading the paperwork's shelf.,stands and presses a button.,has been watching the page.,0
"After, the female throws water with the hose to the woman. A woman wearing white clothes",makes a long shot.,walks in to see.,opens a new room.,laughs in a bathroom.,3
We see meat and cheese on a counter. A man,holds a sandwich in a coffee dish.,talks to the camera in a kitchen.,uses an electric knife to cut teeth.,sets the pasta in a flat saucepan.,1
He heads into the warehouse and the thugs follow. Someone,walks to the side of the lift.,"leans forward, his mouth dragging behind him.",tosses back and punches the thug's door.,"watches him by, then releases a neighbor.",0
Someone guides someone's glass to his lips. Someone,and someone clink his vodka.,approaches and shuts the armoire.,is sitting down watching them.,cocks an eyebrow at someone.,3
We see a fountain spraying water. A mariachi band,is dancing in a park on a solo highway.,is standing around the studio to show a garden.,stands in a cars by some marching band plays.,sits on the sidewalk playing music followed by drummers.,3
A series of masks are shown on a table. A yorkie dog,prepares to strike a strike.,is shown from several angles.,is showing their each act.,looks paying for the camera.,1
Someone wipes it away with a gloved finger. The bank official,gives a wounded nod.,puts down its map.,sends a text message.,shows her the calculator.,3
Someone unlocks the door and opens it. Someone enters and she,walks into the hall.,closes the door again.,notices him watching o..,peeks through the window.,1
Then he finds a tin - opener. The Germans,sneaks up behind him.,throws it into position.,go in a chokehold.,are evacuating the villa.,3
Someone holds up an old playbill. Someone,lifts him in his arms.,takes a seat far back.,touches a large movie camera.,seizes it by its neck.,2
The other climbs a ladder. The girl,flips the lady off to the right.,falls to the start with her feet.,chases an ax above the other tree.,jumps to leave the dog to it.,0
"Someone goes to a door with a window in it and knocks on the glass. On the other side, a man lowers a flap and someone",steps off the roof.,walks into the cabin.,looks into the room.,lies on the train.,2
He takes a piece of paper from one of the cups. The young man,appears and sits down high above several leaves.,crosses the darkened studio with a face up.,peels the sandwich off and takes a break.,is outside putting money all over their heads.,1
Someone meets someone's concerned gaze. Someone,stares at someone thoughtfully.,looks at his son.,smiles at the tv.,"nods, then walks away.",0
Someone meets someone's concerned gaze. Someone,looks at his son.,stares up at someone.,"nods, then walks away.",smiles at the tv.,0
He looks into her eyes and shakes his head. She,looks at him evenly.,jogs back to him.,taps a foot ring.,yanks out a handful.,0
"The ship 'slows to a stop. Gawking at the towering vessel, someone",rises to her feet.,balances as he holds.,hides behind her trunk.,holds out his neuralyzer.,0
"The room transforms into its former state, as young someone and someone step inside. Someone",puts down his quill.,rushes toward a painting.,looks hard at people.,lies box in bed.,1
"She gets up, revealing a tiny T - shirt and boy - cut panties. Someone",connects it to someone.,lies on her couch.,follows reigns to someone.,watches the approaching car.,1
"Someone emerges from the bathroom, wrapped in a towel. Reclining on a sofa, someone",struggles to sit up.,stamps out the notes.,lies in the doorway.,watches someone brace himself.,0
The man and the horse ride out fast after the calf. The man,takes the lasso and starts trimming the cow.,ropes the calf and jumps off the horse.,fell then pulled the calf to the ground.,finishes washing his horse and chase the calf.,1
The trucks pull into an area surrounded by towering stacks of shipping containers. A bearded man exits an suv and his men,are standing at the policeman.,fall into a dirt vehicle.,carry out two military crates.,"pulls off, leaving behind stalls.",2
Someone gives someone an encouraging wave. People,run into the hall in triumph.,dance together in an intricate dance.,look at the naked rock dancer.,look on from a defeated boat.,0
The man makes a smoke ring and blow it to the girl and she inhalates. a man and a woman,are shown playing over a basket.,pull a rope off the pavement.,kiss the woman slamming each other.,are sharing smoke in a room.,3
Someone removes a school photo from an album. Someone,stares at the photo.,sets the flashlight aside.,puts on his helmet.,faces a sustained frown.,0
"Someone shoots at someone, and the car swerves. Someone knocks over his hand and the flare",hits the pavement and falls.,goes off in the car.,gun is aimed at him.,veers up in his head.,1
"People, who holds the baby, climb up a steep hill. As they progress up the hill and the gradient increases, they",climb into a sedan.,turn into someone's car.,reach the lower level.,struggle for hand holds.,3
People are standing on the backs of horses. Three girls,stand on their hind legs.,are interviewed after the girl.,are talking to a camera.,run to the ground member.,2
A woman is standing inside her kitchen. She,applies soap and shaving cream to her face.,is talking to the camera in the kitchen.,shows how to wrap a gift around present.,starts talking to the camera in the bathroom.,1
An arrow goes through the hole of a donut. An arrow,pulls a hole on the ground.,is pulled out with a knife.,cuts the string holding an apple.,is attached to a released point.,2
Another child moves around behind her. More children are seen working and the girl,moves around and fourth.,hops to the side.,laying down looking down.,proceeds to smile slightly.,3
"The woman exercise on front the ocean spinning the stick on her neck. Then, the woman",finish watching the other woman perform.,spins the hoop with her hand.,lifts the weight and spins around.,"begins riding a heavy, elliptical bike.",1
"The cat looked up while the woman is clipping the right back paw of the cat. While the woman is clipping the left back paw, the cat",was blinking to the camera.,is overlaid on the nail.,appears on the left youth.,zooms out holding her toothbrush.,0