startphrase,ending0,ending1,ending2,ending3,label
As he presses a silent alarm under the lip of his counter. Someone,meets the penguins squarely.,honks his horn furiously.,aims at someone's hand.,searches for alien effects.,2
A woman in a black shirt is dancing. She,begins playing the violin.,is playing a violin.,is twirling a baton.,is playing a flute.,2
Someone faces someone and shakes his head. Someone,goes over to someone.,reacts to the applause.,hangs over his cell.,spots a map envelope.,0
One of the men washes the dog. The other man,records what is happening.,points to the container.,wiped his shirt again.,throws some other products.,0
"At night, someone takes out the trash behind Pleasure Pizza. A large group of teens",ride on the suv.,sit on a hilltop.,stand in the sidewalk.,creeps up behind them.,2
"At night, someone takes out the trash behind Pleasure Pizza. A large group of teens",sit on a hilltop.,ride past on bicycles.,gather in the highway.,ride on the suv.,1
A stands woman by a ball and sets it in place. Another woman appears and they,swing around in a circle.,continue talking about the game.,continue to fight each other.,are awarded awards and talking.,1
Someone climbs a ladder on the platform. Someone,wrestles someone to a mat.,goes into camp behind him.,lifts himself into the air.,sits down and glances over.,0
"We see more words on the screen. Two men hug each other, and the man in the tanktop",gets a gold trophy.,brings a new match.,adds the newscaster's hands.,goes to the bottom.,0
"She opens her bag and pulls out the stun gun. When the troll does n't move, she",checks his heartbeat and tries again.,pulls her gun off her body.,moves away from the wood site.,does n't say anything to it.,0
"She settles onto a window bench. Closing his eyes, someone",puts on his spectacles.,enters and joins her.,ventures anxiously on him.,hands him the pager.,1
"Someone leads his men out at a march. Now, someone",figures him through a clearing.,snatches the bomb cables nearby.,waits in a car chamber.,leads someone down marble steps.,3
The army of cattle moves off. Someone,stops the meager total.,drives away from them.,lets the national anthem.,climb off the train.,1
Someone comes to a halt. An oil wales,come to a stand still.,loads something onto the side.,fills the goblin warrior's portrait.,blazes on its red hat.,0
She puts her arm around someone's shoulder. Someone and daughter,"elves, at the river.",share a slight smile.,share a tender stare.,share a quick glance.,2
Man is climbong a rock wall atached to harness. a group of friends are standing on the field and above them the man,watches using some athletic pole.,is climbing the rock wall.,is standing next to them.,seems to be being hit.,1
A deck hand brings the board and the photographer hands it down to someone. Someone,lies down on his board and paddles away.,wrestles a brown - haired player at someone.,grins at someone and smiles as everyone returns.,looks at his daughter and extends her hand.,0
Someone looks up at the house. His face,is wild with horror.,partly hidden in shadow.,is covered in ash.,surges beneath a wave.,1
He shuts the door behind him. Someone,turns on a lamp.,lies in his bed.,pulls off his hood.,jumps into the room.,1
"Outside the enormous rear life supports move into position. Nearby, someone and the others",go into the gloomy corridor.,walk in towards the hedge.,"put round, catching their breath.","monitor him, slowing but puzzle.",1
They run out into the street. Someone,drives someone down a sidewalk.,arrives in front of them.,walks past someone and someone.,is loaded into the cruiser.,1
She speaks to the camera and moves her arms up and down. She,brushes her hands and begins rubbing her back.,continues to move her arms up and down.,continues to play the drums with her hands.,does a final stand and is bowing again.,1
She then begins playing the instrument while a boy watches her from behind. She,continues to play the violin while holding the package tightly around her.,continues playing while playing the instrument while still speaking to the camera.,continues playing the flute and smiles to the camera while looking around.,continues dancing on the floor when another person steps out of frame.,2
"He talks at someone's ample chest. As someone takes a drink, someone",continues to pull away.,shakes his head skeptically.,blocks his doctor's grip.,straightens up the microphone.,1
A person is seen turning her neck to the side and a person wearing gloves holding a needle. The person then,begins tattooing the dog with the electric razor.,pierces the ear of the girl sitting down.,gets the contact lens out of her eyes.,uses a set of sheers for the panel.,1
The girl jumps another square. The girl,jumps a third square.,falls off her feet.,stands thoroughly leg up.,continues speaking while next.,0
A woman puts a hand on a horse. Two girls,follow the little dog up another driveway.,are outdoors in shots fighting and judges.,brush the horse from the other side.,are brushing her teeth in the water.,2
"Gradually, in tiny starts and stops, their faces come closer and closer together. Someone caresses his neck and their lips",touch with an wry smile.,meet a tender tender kiss.,"meet, gazing at each other.",meet in an elegant kiss.,1
"It lands on the station floor, behind the inspector and Maximilian. The inspector",stands and kicks the man overhead.,punches the elk on the head.,"climbs toward it, then faces him.",turns and picks up the wrench.,3
Someone sinks his face into the bowl. Two young girls,lie asleep on their bed.,raise their arms and kiss.,sit down from the stove.,step out of the room.,3
Someone stands frozen in the doorway. Someone,sits down next to the penguin.,looks up at the great beast.,stands slowly towards the packed skyline.,is tending to the wounded someone.,3
"There two old men wearing straw hats, dressed in t - shirts and shorts getting ready to play shuffleboard. There two other men",begin playing and playing indoor tennis.,playing and behind the other man.,play drums outdoors area in exercise.,perform croquet in a chinese event.,1
"Above the bar, someone's white face appears upside down to someone. Someone's",head looks watching someone.,anguished gaze slowly downcast.,fingers clutch his waist.,pointed teeth are contorted.,3
"His hand shakes as he cocks it. Someone stands before him, the gun",pointed at his head.,back into his neck.,tucked under his rocks.,surrounding his firm hand.,0
We see a boy cut open and clean out a pumpkin. The man,shows us how to decorate it.,cuts the wrap with the newspaper.,cleans the shoe with a knife.,blows green paint on the tree.,0
They move back and forth in the confined space. They,twirl and spin as they dance.,sit in an outdoor parking lot.,dip down and get to dance.,step forward on the other side.,0
Someone pulls out and speeds through the garage. A helicopter,flies over district 9.,passes to the ground.,rises from his arena.,rises over her perimeter.,0
As two other ladies make out. Someone,does a plume of smoke.,finds someone in his tuxedo.,scampers down at his feet.,watches with someone and someone.,3
A couple of the throwers lose balance and stumble during their turn. Officials,pass the race to successful raise and face each other.,come to the platform and start placing tools for measuring.,have to shoot at many things inside the governor's office.,jumps down onto the water and talks about their tricks.,1
A clip of a woman applying wallpaper is shown. The woman then,begins to paint its razor.,begins putting wallpaper up wall.,begins speaking to the camera.,demonstrates various rules of moves.,2
A clip of a woman applying wallpaper is shown. The woman then,demonstrates various rules of moves.,begins to paint its razor.,begins putting wallpaper up wall.,wets a piece of wallpaper.,3
"In a bathroom, someone applies makeup to his bruised eye. Someone",puts her reflection on her breasts.,takes someone's cube from the hatch.,blends the makeup on his skin.,reads a departure to the news.,2
"Someone removes his coat as a doctor approaches him, then turns to see a priest. Someone",nods and looks down.,steps on the cross.,enters with a folder.,takes it from someone.,2
"In a sped up motion various clips of a road trip play where we see a long stretch of road at night turning into day, men in a car, and daytime driving. Continuing in a sped up motion we",see a circus bird in the snow.,see the arrival at a ski lodge.,see the skiers walking on a road.,see the tire on a jet ski.,1
Someone goes to sit on the stairs. A smile slowly,travels up his face.,unfolds on her cheeks.,rises from his cheek.,spreads across someone's face.,3
A woman approaches behind her. The woman,pushes someone back backwards.,stops brushing her teeth.,garnishes the food hungrily.,walks out of frame.,1
Onscreen a mustached man kisses a woman. A cowboy,arrives with a tray of flowers.,licks her lips with the pads.,leads the way into the bathroom.,floats him and knits her brow.,0
He is in his kayak paddling downstream. Another rower,appears in the sky.,sets someone's feet nearby.,flies through the air.,appears on the screen.,3
The girl points the camera to the ground. A half manicure hand of another girl,is running along the square.,plays harshly on the wall.,is seen on the floor.,squeezes brown with the brush.,2
"Someone hesitates, then begins. And someone",follows close to someone.,goes back to him.,slowly takes the telegram.,is desperate for someone.,1
"Someone hesitates, then begins. And someone",slowly takes the telegram.,is desperate for someone.,has drawn himself up.,follows close to someone.,2
"He closes his eyes as he clutches his daughter, then opens them with a fearful look. Someone",gives a weary blink.,watches from a window.,turns and walks off.,stares at the moon.,1
Someone drives slowly through a suburban neighborhood. Someone,rolls down her window.,hurries into another car.,jumps on one escalator.,enters a dark apartment.,0
Someone bounces in her seat with excitement. He,soars toward the suv.,turns and gets up.,gives a coca wink.,guides the noblewoman up.,1
A ballerina is seen walking out onto a stage and leads into her performing a ballet routine. The girl,begins dancing around the audience and ends with her dancing around.,spins herself around on her shoes while the audience watches her.,continues to dance on the beam while dancing with hula hoops.,continues to style the instrument while looking off into the distance.,1
"The locomotive pulling cattle and goods trucks comes into sight, rolling slowly towards the boundary of the Umschlagplatz and coming to a halt. Among the great throng of people, the people",leap into the abyss.,break through the door.,run down the street.,trudge towards the train.,3
"Someone shoves her friend, then allows a smile. Behind them, someone",laughs at her mother.,trips over her chair.,runs down the stairs.,hesitates for a moment.,3
"Someone flaps her hands in disgust. In his bed, someone",puts a pillow over his face.,drags the babes through the ceremony.,heaves his cream through blonde curls.,leans his lieutenant baring his teeth.,0
Someone tramps through another part of the woods. Twisted roots,scuttle out from under him.,emerge from an approaching engine.,flash across the electronic screen.,lie among the towering trees.,3
"Morning, someone feels someone's flushed brow as she lies in bed. He and someone",get to their feet.,sit in her bed.,"follow, closing their eyes.",share a warm embrace.,3
"Someone kneels down and looks at someone earnestly, his hand on someone's shoulder. Someone","stands, staring at the cameramen.",sits up and sits down.,smiles warmly at his friend.,looks excitedly over the map.,2
Two men are shown cleaning windows on the side of the building. They,rub onto the plaster along white field.,squeegee and wipe down the glass professionally.,sets the set down throughout the process.,are now inside scraping on the ice.,1
Someone rubs someone's back. Someone and someone,stand before the riverside.,stand around a cage.,arrive at tested lair.,reunite in another tub.,3
Man is in a static bike going really fast like practicing for a competition. man,is talking to the man and is standing on the rope going down.,is in a studio day talking to a camera and showing a bow.,falls to his stomach and is seen doing his stunt and doing situps.,stands on the bike to go faster and is looking to the camera.,3
"Inside a market, she closes her eyes as she smells a bunch of fresh basil. Now she",turns to the camera.,fastens her friend's collar.,hands him an envelope.,takes off her bag.,0
"With a wounded glare, the rock star steps away in his burgundy briefs. Later, someone and someone",make sparkles at each other's tables.,dance side - by - side.,sit eating breakfast between two kids.,make a exit in another attic.,1
"The girl get out and stand on the border of the structure, then while the man puts a rope behind the girl. After, the girl jumps from the structure for a moment and then she",gets to the sand pit.,stands outside the sand castle.,gets up on the structure.,continues riding the bikes again.,2
"Wearing a floppy cap, someone warms his hands over one fire then stuffs them in his pockets and walks off. Later, he",heads down a sidewalk of darkness.,swerves frisbees in the witches lair.,sits at the desk behind someone.,tosses the script at his desk.,0
"With an almost pained expression, someone wraps an arm around someone's head. Ending their kiss, people",share a tender gaze.,resume their racquetball perfunctorily.,let off smiling relief.,head into the kitchen.,0
"Someone crosses to his lifelong friend and drapes his jacket around his shoulders. Stepping in front of someone, he",passes a gun to someone.,puts his arms behind him.,crouches and touches his arm.,gestures at his blonde mother.,2
"People are now very close. During the ensuing low - spoken dialogue, they",put their hands all along the floor.,"are both wearing earphones, forming a room.",'re engaged in dance performing similar activities.,"begin to move, dancing as they talk.",3
The man lifts the weight over his head. The man,lifts the shirt off the ground.,scans shaving cream on his leg.,drops the weight to the ground.,finishes jumps and drops the weight.,2
A logo for School of Psychology appears on screen. A photo of a bearded man,is shown holding a pole.,is on a cutting board.,begins company into a laptop.,appears reading by describing instructor.,3
"Elsewhere, in a home, a young, long - haired woman walks past a small dog. In an adjoining sunroom, a white - haired woman",wears a surgical mask.,addresses a makeshift stage.,uses a pottery wheel.,unwraps a blonde parcel.,2
He dives for cover as the coach flies low over his head. A tall mast flying a slender pennant,looms high with a red dragon's nest.,swims toward the front of the building.,looms before him by a large ledge.,of knocked clouds come to the beach.,2
He puts the weights down and looks at his reflection in the window: His arms are pumped. He,"leans against the door, angry.",lies down on his knees.,"races wildly, releasing his hand.",crouches down and continues talking.,3
"The tall prisoner, who has a beard, closely - cropped hair and a stoop, turns back from the broken flagpole on the ground. A second prisoner",steps into the file tray.,is in a quiet bay.,rushes back into the hall.,is stopped from following him.,3
She takes a break from the bike and does tome abdominal exercises on the floor. The video,ends with the closing captions shown on the screen.,ends with the closing captions shown across the screen.,begins with the series of people on the elliptical.,ends with the opening credits shown on the screen.,2
"Now the bean shaped cloud gate in Millennium Park reflects an overcast day. Inside a high - rise building, a woman at a conference table",sits wearing an airplane seat.,sits up with his hair.,watches someone by a window.,audience hugs the other men.,2
"Now the bean shaped cloud gate in Millennium Park reflects an overcast day. Inside a high - rise building, a woman at a conference table",audience hugs the other men.,sits wearing an airplane seat.,sits up with his hair.,slides legal documents to someone.,3
Bringing up an email account he finds several messages from cooldeets88. Someone and the nerds,listen in on someone and someone.,tip the barrel into his cheek.,spot him to change his seat.,are in line detailing the wheel.,0
A cup full of ice is shown and a person pour drinks on the cup and make a cocktail. a cranberry cocktail,is placed in the jar.,is with a steel ball.,is poured in the bowl.,is serve in a cup.,3
He takes two bags from his father. The young man,boards a waiting bus.,tosses someone a suitcase.,stares at the roof.,hangs a life jacket.,0
"Toting his gun, someone climbs out of the cruiser. He",ducks into a parked car.,"exits the records room, horrified.",takes it away from someone.,catches someone in a web.,0
Someone heads to the passenger side of someone's cruiser. They get in and someone,gets back in his truck.,leads someone to the door.,backs away from the crowd.,shoots at the stop outside.,2
"Meanwhile, someone answers his phone. Someone",stands at the datebook.,sneaks across the house.,dials a phone number.,opens other ear buds.,2
"As she passes ground zero, she glances at people gathered by a fence adorned with flowers and flags. Now, she",turns around and spots a candy.,finds a portrait of someone's colleague.,performs a diagram of her lawn.,finds someone at a store entrance.,1
"She picks up a phone and dials. In the garden, someone",works at her computer.,sits in the lobby.,steps into the driveway.,takes his phone out.,3
Someone gets in the car. Someone's briefcase suddenly springs open and his papers,fly in mid - air.,fly out of his eyes.,spill all over the driveway.,fall on top of someone.,2
Someone gets in the car. Someone's briefcase suddenly springs open and his papers,fall on top of someone.,fly out of his eyes.,fly in mid - air.,fly out of the window.,3
A cameraman rises up on the riverbank. Two new individuals,paddle down the river.,continue on the bikes.,fall from the flies.,enter a motel room.,0
A group of men and women are doing jump rope for aerobic exercise. They,are each doing various things in a gymnasium.,"are shown on the court, dancing and spinning.",are participating in the water as a race.,"run in a circle, jumping as they run.",3
"A man, wearing snow goggles, a winter hat and jacket, talks to the camera while filming himself snow boarding down a snow covered ski slope. The man snowboards down a slope using one of his free hands to film himself as he passes other skiers using ski poles to ski, snow",is up the hill.,swiftly down the mountain.,is on the planks.,covered foliage and landscape.,3
Someone moves on then pauses warily. She,jogs out of view.,takes off his reading.,nears a blurry gap.,tilts her head angrily.,0
People are among the spattering of passengers. They,get to the lift.,rise from their seats.,go into the cabin.,move to the bar.,1
We see the title for Kyla Ross on the parallel bars. The girls,"lifts, then lowers her arms.",swings utterly in the field.,hands over a large machine.,toast and cheer while continuously.,0
"She has a rich body. Someone comes to her and she picks up someone and the doll; someone, laden with his oath,",tinkering with a large nostril.,urges her in the mirror.,has his rear on him.,walks quickly into the house.,3
"He leans his head against the back of the settee, acutely uncomfortable. Someone",appears on the stairs.,shifts his thoughtful gaze.,hands someone a locket.,is fuming a little.,3
Someone puts her hand on someone's hand. Someone,floating through her clothes.,leans closer to someone.,nods as he remembers.,starts for the door.,2
Now in the guesthouse someone and someone share a tender passionate kiss. He,gazes into her eyes.,giggles to the beat.,gently kisses her cheek.,meets his earnest gaze.,0
"The little boy is at the sink brushing the pot. The boy lift the brush from the pot and brush the sink instead, then he",sprays it on his face.,brushes it with a toothbrush.,put it in the pot.,continues to dry his foot.,2
Several spectators are watching them and cheering them as they continue to play. The players,are applauding and enjoying team player step.,finish tossing the ball in the air.,continue to pull the rope with concentration.,are playing basketball while watching the game.,2
The white - haired businessman gives a confused look. The lights on the lounge's archway,shine in a hallway.,washes through the ceiling.,reveal a cigarette lighter.,glow onto the sidewalk.,3
"Someone trudges out after the officials, leaving someone sitting alone, brooding. Someone",nods as someone reads the letter.,leans forward and checks his watch.,smiles and shifts his weight forward.,puts his face on his shoulder.,3
"They look around fearfully, as armed figures march out of the jungle through the smoke. As the boys run pell - mell into the water, the Japanese soldiers",advance past the mission buildings.,flips in the street outside.,get over to help someone.,are ready for the match.,0
"With his eyes closed, someone's head hangs to the side. Medical workers",tend to the medic.,tend to their patients.,surround someone's unconscious zookeeper.,appear on the dock.,1
"People are in the car, parked across the street. They",are on their knees.,fight over the phone.,are staring at someone.,don't see the man.,2
2 a guy talks about playing the saxophone. 3 The guy,throws off the clip.,plays the saxophone again.,starts to play guitar.,leaves off the paper.,1
"The reverse shows someone approaching from her own squad car. The first car's driver door opens and a figure in a parka emerges,",pulls on the trail.,shakes down his hand.,glaring at the wig.,holding two styrofoam cups.,3
Someone slumps back into his seat. Someone,straightens his chin and lets someone a gentle kiss.,"approaches someone, who's shielding his face with his fist.",carries him to the table where someone lies awake.,walks into his room and looks at the sofa.,1
"Someone obeys in a trance. Someone, gun at ready,",returns to the bedroom.,looks up at someone.,begins to record them.,looks into the darkness.,3
Man applies an alcohol - based stain. The man in a white shirt,is holding the drink.,is standing his stilts.,walks past the fbi.,holds up the wood.,3
The camera zooms in on cookies on the dashboard of the car being baked inside. A digital thermometer,of reception is shown.,is in the farmhouse.,spills down the screen.,shows the heat temperature.,3
Someone follows her to the elevator. They,clasp on the cigar.,step onto the door.,lifting her from bed.,exit into the lobby.,3
"The man is using two ropes, he's maneuvering the kite with both hands. The kite is flying round and round, then it",flew high then low.,falls off the ground.,bursts from the sky.,falls into the air.,0
"It spreads to the wall, then surges around the room. Standing at the atrium's center, someone",does a guard raise handed a came.,directs the roiling flames with his gaze.,puts one finger removed and walks out.,poses with the string in bungee arm.,1
He hands someone the thin envelope. Someone,quickly goes back to the present.,catches it with a shotgun attached.,takes the ring from his pocket.,thoughtfully runs his thumb over it.,3
A teenage girl brushes her hair. The girl,starts to blow dry her hair.,stretches the leash on her face.,cuts the ladies's hair with brush.,brushes them off the eiffel head.,0
Someone gazes across the field. People,arrive at someone's mansion.,pull at a pedestrian.,sit in the kitchen.,walk into the school.,3
"Behind him, a dim light glows inside the tent. Clutching someone's wand, someone",plants his hands on his knees.,gets back in the meeting room.,separates the top from the canvas.,rests his rifle on the tree.,2
A group of children are gathered at an outdoor event. They,are engaged in a game of cricket.,are engaged in a game of kickball.,are engaged in a game of curling.,are engaged in a game of kickboxing.,1
An old man with beard is giving interview. The man is arranging the ball on the table and then hit them and they all,continue to read it.,want to fix it.,went into the holes.,begin to stir it.,2
Someone pulls out the other chair. Someone,looks up at him.,sits at a table.,climbs off the bed.,holds out her wand.,1
Someone reaches into the front seat of the van and pulls out his twelve gauge. He,points it at the tow truck driver.,rips the whip off his second belt.,looks up from the bug eyed bottle.,closes the bar and steps down together.,0
A man does a news report about running through Paris. He is in a Naruto costume and others,tobacco and gives an interview.,are in costumes as well.,taking people off with him.,'jump is high as well.,1
"He reaches his truck, then looks around. Someone",tilts his head stubbornly.,tries on his radio.,bursts into a corridor.,materializes behind the hatchback.,0
"While they are talking, a game is being played and the two watches them. After, the man begins teaching her various techniques used in the game and they",are about the mechanics of the game.,continue doing gymnastic moves across the field.,begin playing the game during the game.,engage in a game of bowling games.,2
"As he enters, a staff of employees halt and face him. He",leaps into someone's arms.,shrugs his brow grimly.,runs into the office.,turns to the lieutenant.,1
A child opens a bedroom door. The child,holds the lid open.,stops and turns around.,runs down the passageway.,slides down the slide.,1
