ending1,ending2,ending3,ending4,label
lays their meal down.,are still playing and drinks.,picks up a glass.,raise a clutch bag.,0
are still playing and drinks.,picks up a glass.,raise a clutch bag.,spread a tablecloth for them.,3
is flared open.,is not quite empty.,has been held before him.,makes it impossible.,2
has his legs shaved.,hangs onto a curved ceiling.,performs give high five.,rests on his desk.,3
leans on his desk.,puts on his jacket.,pauses and looks after her.,turns to look away.,3
pauses and looks after her.,turns on a light.,leans on his desk.,puts on his jacket.,1
walk over to it.,glow underneath the sofa.,get up from an spot car.,come in to get out.,0
line the wall behind him.,letters appear with a pencil.,flashes across the screen.,are lying on their knees.,0
is then on a green river.,floats up around them.,is also in the river.,is floating down the river.,2
catches someone's eyes.,spill down someone's cheeks.,turns off a resolute look.,leave her bedroom.,1
gets to the feet.,gets off the train.,gallops along the snow.,them in their wake.,1
portions of a butler.,combs the hair together.,adds blow drys her hair.,hair at a first dryer.,2
throws the snow off a taxi.,steps up to the bar.,peeks in the guest room.,uneasily touches his eye.,2
cleans at a beach hole.,is swimming in a crevasse.,is shown water surfing.,jumps in front of the camera.,1
begin to kiss passionately.,fling the boy from the kid.,shuffle in to other exit.,both lean against the bar.,0
presses a hand to his brow.,fires desperately.,picks up her sweater.,hands him the money.,2
walks into the room.,is cutting the grass.,is walking next to him.,is blowing all the leaves.,2
walks to a restaurant.,stands on front a man.,is taking a picture of them.,walks across the room.,2
rushes out into the corridor.,glares in the other windows.,climbs behind to his feet.,takes off his clothes.,0
puts on his reading table.,plays his button.,looks at his sleeping wife.,sucks her fist upward.,2
leaps to his feet.,is wearing a torn mask.,can be seen in surgery.,withdraws from the envelope.,0
are demonstrated by them.,are displayed on a table.,are molds in a bucket.,of care are shown.,0
are out on the screen.,are shown in the water.,are playing in a park.,are shown in a room.,3
go and serve the ball.,break and hug and shoot.,run onto the court.,hit the ball on the field.,2
return to his place.,break and hug and shoot.,hit the ball on the field.,go and serve the ball.,0
remain frozen.,exchange a knowing look.,nods on his hands.,walk together in silence.,1
gives her an admiring smile.,faces the young man.,strides back to her laotong.,spots feathers on her feet.,0
nuzzles with each other.,strikes him in the face.,smiles at the loving group.,"watches, slack - jawed.",2
are then placed on the egg.,are sitting on the counter.,are mixed with a sandwich.,are shown in the glass.,1
opens onto his partner.,is staring up at him.,tilts its head.,rests in a large case.,3
drags her to the sedan.,gallops at her feet.,falls off in front of her.,watches her chair disappear.,0
gallops at her feet.,watches her chair disappear.,collapses against the ground.,falls off in front of her.,2
stares up at the building.,falls in the trees.,looks over at someone.,runs up to him.,2
runs up to him.,stares up at the building.,shakes someone's hand.,falls in the trees.,2
has entered in background.,is alone in the center aisle.,looks a little confused.,"looks at someone, horrified.",0
are shown at a sink.,are shown for the camera.,are displayed in the kitchen.,are used to put on the sink.,2
are then washed as well.,are shown for the camera.,are shown at a sink.,are used to put on the sink.,0
strides off for the podium.,comes up once more.,lays down someone's newborn.,is leaving as she listens.,3
does her jumps a few times.,laughs in the first class.,helps her onto her horse.,comes to help her.,3
takes a second from her lips.,climbs into the cab.,comes away from the house.,looks down at her.,3
climbs into the cab.,comes away from the house.,keeps looking at him.,takes a second from her lips.,2
enters and enters the room.,arrives at his computer.,holds up his hands.,walks up to the bar and sits.,3
starts to open the phone.,looks out at her.,follows her down the street.,steps closer to someone.,2
lowers her into her arms.,looks out at her.,starts to open the phone.,comes forward bare - chested.,1
talks to the camera again.,looks surprised to see.,sits on the bed.,talks into a microphone.,0
are stacked with posters.,are stacked with snakes.,slide down the stone floors.,"are gaping, peering inside.",0
lets out a sigh.,heads out into his kitchen.,dons a baseball cap.,takes someone 'belt.,0
heads out into his kitchen.,dons a baseball cap.,takes someone 'belt.,pokes someone with the gun.,3
scurries down some stairs.,carries a trash bag.,uses an outdoor mirror.,leans in a mirror.,0
uses an outdoor mirror.,carries a trash bag.,makes it to a thin pier.,holds it for her.,1
makes it to a thin pier.,holds it for her.,passes the living room.,uses an outdoor mirror.,2
runs past a person.,chases after the baby.,comes out the view.,pass behind the girl.,0
comes out the view.,pass behind the girl.,chases after the baby.,walks around the area.,3
tilts the oar to her.,gives a stunned blink.,closes her eyes expectantly.,takes it from her.,3
tilts the oar to her.,is playing a smiling someone.,closes her eyes expectantly.,dives into the water.,3
plops onto the kitchen bed.,opens it and reads.,hangs up the phone.,takes the book and signs it.,1
heads back to someone.,drops on the table.,shows someone standing up.,rises on the table.,1
shows someone standing up.,heads back to someone.,lands in the dirt.,rises on the table.,2
runs to the stairs.,"falls face down, motionless.",yells back to his ear.,runs for the man.,1
rains down on him.,arms are now carved.,flicker on the bottom.,picks up another oar.,0
is busy held by a rain.,comes down behind him.,reaches the bottom fender.,has slowed down considerably.,3
flood out from behind him.,get into the car.,lie in the same direction.,lie huddled face to ceiling.,2
jumps into the ring.,rushes off of them again.,walks over to flags.,falls freighters behind him.,0
falls freighters behind him.,hits the side to tap out.,walks over to flags.,rushes off of them again.,1
shakes his head sadly.,grins at the teacher.,darts up from the wall.,storms to his car.,3
switches off the accordion.,breathes on his lungs.,beat the drums fast.,"is swinging, talking.",2
tries to look away.,almost throw off the church.,chase her out of the car.,stop them from view.,0
sit down and applaud someone.,stop them from view.,almost throw off the church.,chase her out of the car.,0
lies on a pink sheet.,is adjusted using pliers.,spins like a metal disc.,are shown on the ground.,1
looks outside the window.,sees him and startles.,stands up and close the door.,is gazing after his dad.,0
glides down the slide again.,interacts with one brown dog.,stands on her way.,steps up the slide.,0
protect the drive - on.,are lit with candles.,is ice running after.,pose at a sidewalk or ajar.,3
is ice running after.,make their way across a flat.,are lit with candles.,protect the drive - on.,1
pounces down on the goal.,is blocked by the goalie.,comes to their stop.,leads replays a slow motion.,1
is the driver of the car.,is wearing an unmarked hat.,"walks away, slowing his pace.",stops her bicycle car by her.,0
lifts his body insistently.,gets behind the car.,turns off the pursuit.,sees someone.,3
hits someone with the spear.,remains seated by the lounge.,speeds away from the ship.,relax as they compete.,1
waves to the crowd.,looks at him.,listens to the stripes.,pops onto the screen.,0
moves over to them.,"sits there, waiting.",slides to to another stop.,looks like a cop.,1
strides over to him.,does n't like what he came.,spreads out the blood.,slides open its door.,0
flips over the monkey bars.,begins spinning in circles.,jumps over the bars again.,stands on the bars.,3
runs off to investigate.,shoots an elegant look.,appears out of sight.,takes out her sawed.,0
see a 5 printed screen.,see a matador on the screen.,see the closing title screen.,see a full title screen.,2
see a matador on the screen.,see a 5 printed screen.,see the ending title screen.,see a full title screen.,2
hands over his sergeant.,raps on the horn.,stands on a metal ridge.,attempts to help him stand.,3
lands in the same position.,grabs one of the other.,hops on the girl.,lands on the pole.,0
steps through a small alcove.,drifts into the room.,steps close to the panel.,sleeps with his eyes closed.,1
turns and sees us.,massages his own hand.,drops his torch again.,stands in a corridor.,1
tries just leaving the water.,is sliced on jaggerman sub.,waves hulking at the caddy.,resumes tracking the pair.,3
sits on a velvet counter.,reaches an unpaved road.,slides out trails nearby.,is ground out in an alley.,1
falls to the floor.,falls on the floor.,spins the hoop four times.,dives to the ground.,0
falls on the floor.,adds balls to the hoop.,walks towards the camera.,dives to the ground.,2
dives to the ground.,jumps in the air.,adds balls to the hoop.,falls on the floor.,1
stands close to the door.,'s shadow inside the kitchen.,arrives outside her door.,emerges from the brothel.,2
emerges from the brothel.,'s shadow inside the kitchen.,stands close to the door.,staggers up the stairs.,3
lands over the block.,goes through the basket.,bounces off the floor.,goes to the bottom.,1
appears on the background.,begins shown in slow motion.,is shown across the screen.,shows how to shave your legs.,2
appears on the background.,begins shown in slow motion.,shows how to shave your legs.,appears on the screen.,3
dances around the room.,speeds through a red light.,starts to click the card.,looks at a guest car.,1
is a record there.,are tears in her eyes again.,is tears in her eyes.,is only reaction silence.,1
gives a cordial hug.,walks over to himself.,sits up and stares blankly.,puts her hand in the air.,0
are playing in a court too.,is waiting for their bikes.,is playing a game in a barn.,is holding the rubiks cube.,0
is playing a game in a barn.,is waiting for their bikes.,is holding the rubiks cube.,are sitting around excitedly.,3
gives him a change.,is ready to close the door.,stops in front of someone.,is smaller than usual.,1
takes out his wand.,pokes his head in the back.,stares at him as he watches.,sprawls to the ground.,0
stands on the podium.,holds a gun nearby.,gives a nod and heads over.,uses an electric radio.,1
meet down the street.,find the spot hydra.,lie across the rugged ground.,enter a hotel lobby.,3
follows her through the gate.,"looks around, bewildered.",cringing to a stoop.,comes out with a shock.,1
swigs another from a bottle.,loses an indignant gape.,walks off with shock.,enters with a smile.,2
swigs another from a bottle.,checks his own clock.,enters with a smile.,loses an indignant gape.,2
nuzzles the brunette's hair.,picks up his box.,glumly hands someone a chart.,leads the fbi woman away.,0
glances over his shoulder.,looks at a file in his hand.,pulls someone up beside them.,gapes at her phone.,1
is gathered in front of a tv.,is gathered behind the house.,is gathered outside a window.,rides around on a dirt cycle.,0
see the finished painting.,see the screen on the screen.,see the ending title screen.,see her attach the product.,3
share a tender embrace.,exchange a thumbs hug.,smile at each other.,fly out of the lot.,0
noose around his neck.,are being led by someone.,dimly illuminating their way.,coffees into the courtyard.,2
look at him: silently.,are milling around the lobby.,look out over a tattoo shop.,run to the beach shelter.,1
struggle with one another.,look in each other's eyes.,exchange a thumbs hug.,fly out of the lot.,0
becomes a little bed girl.,stops brushing the horse.,returns its left foot.,puts on a eyelids.,1
runs in a gym.,talks to a hookah player.,does a bunch of moves.,walks away from the shore.,2
place a sheet chocolate.,stacks cups and chips.,put the pan in the oven.,float after: meat.,2
"laughs, both giggling.",watches his hand carefully.,is into the back.,inches towards one creature.,1
collapse at their feet.,disappear under the rain.,burst out of his jersey.,go long as he unbuttons them.,2
get into the boat.,tread down a hallway.,start to pull them together.,enter the dining room.,0
moves back to his son.,pulls the wires away from it.,yells up at him.,turns to her and smiles.,2
swim laps in the pool.,step into another passageway.,spots the opposite.,stroll towards a theater.,1
moves back to his son.,lowers him to the ground.,sits back in a chair.,pulls the wires away from it.,1
spots the opposite.,swim laps in the pool.,stroll towards a theater.,climb onto main deck.,3
is soon to himself.,sees an emt approach someone.,walking into the blackness.,appears on the light switch.,2
are shown at the top.,are after the pilot.,falls down from the water.,begin to get in the dirt.,1
waits outside the hospital.,forces a deep smile.,emerges from the vent garage.,leans back in the chair.,0
whacks someone in the eye.,lowers his gun to the floor.,takes someone's hand.,smacks someone's face again.,1
turns and walks off.,directs his bowl to a room.,leans back in the chair.,emerges from the vent garage.,0
comes into the station.,slams the door shut.,smiles and shakes his head.,backs away from someone.,0
hangs down one side of it.,speeds into the drive.,pulls up at hobbiton.,passes through the jungle.,1
plays with the frisbee.,hold the dog to the ground.,try to catch him.,keep the dog in the field.,0
opens the emergency combines.,hurry up behind it.,climbs up the street level.,kicks his tools aside.,2
lays her hand over his braid.,gets away from the baby.,falls back with the curtain.,halts and makes a face.,3
"is clean, tired and dirty.",glows in her sleep.,reflected in the pond.,gazing through closed book.,1
reflected in the pond.,moves on to the screen.,"is clean, tired and dirty.",gazing through closed book.,1
steps to the doorway.,steps up in front of someone.,raises that of her.,hangs on to one button.,0
begins to groom her foot.,throws them down at her side.,lifts her brow after him.,puts the copyright aside.,1
hands over his cellphone.,heads for the podium.,watches from a crowd.,offers his weapon to someone.,0
is seen between the clouds.,"change, finished its cube.",engaging for safety is shown.,cutting board is shown.,0
puts cream to her face.,give each other a hug.,leave their table carpet.,pass to the women.,0
begins throwing a dart.,is walking in a kitchen.,dives to assist him.,is doing down the hoop.,2
looks at the referee.,has completed his racket.,is doing down the hoop.,is walking in a kitchen.,0
gives a half - smile.,shifts her dejected gaze.,takes her two out of her ear.,pulls the stop cord.,3
walk in a line.,come and bows at the end.,talk to other racers.,perform with pom poms.,3
nuzzles someone's chest.,lays her back on the tub.,drops to one knee.,reaches his inside door.,0
find a cake behind a counter.,move around a bit.,"race together, beaming.",go away on the serving bar.,0
flips off a air board.,is calling at the bureau.,dives high into the water.,creeps up behind her.,3
pass the california border.,walk up to her and leaves.,kiss him on the shoulder.,leave the conference room.,0
walk up to her and leaves.,drive along the drive corner.,leave the conference room.,kiss him on the shoulder.,1
who plunges into the pool.,up back the beam.,hurries up a grand staircase.,'s team steps skyward.,2
drops into a wall of water.,somersaults onto the ground.,lands on a headlamp.,shoots off into the distance.,1
holds up one decree.,grins as he smirks.,smirks and then backs up.,slams down her suitcase.,3
packs from the back.,wipes away a tear.,speeds along a quiet street.,leaps onto the balcony.,0
recover from their collision.,stare at the field.,turn onto a street highway.,hold their hands barred.,0
looks around the clock.,shoots the officers inside.,sits on the steering wheel.,holds up some cards.,1
hurries to the top shelf.,allows a bashful smile.,holds inches to her face.,puts her hand to her head.,1
holds inches to her face.,hurries to the top shelf.,backs away and bites her lip.,shakes her eyes shut.,2
pushes the door closed.,dashes out of the cab.,collapses back on it.,passes someone on the ass.,0
collapses to the floor.,grabs someone by the leg.,rolls on his back.,turns to face someone.,3
slips back into the puddle.,dashes out of the cab.,passes someone on the ass.,collapses back on it.,0
looks down at someone.,lands on the mat.,"has long, dark hair.",hands down his arms.,0
gazes at the controls.,peeks back out the window.,turns and stares skyward.,stares at the docks.,2
drives up with people.,heads out through the rain.,peeks back out the window.,stares at the docks.,0
rolls in from side to side.,is short and short.,is now dark brown.,is covered in bandages.,2
pushes him in the swing.,is seen clapping behind him.,laughs with a dog.,runs around in the end.,1
bounces them high in the air.,talks to swim in the hand.,zooms in on the pool.,talks over the camera.,2
bounces them high in the air.,talks about their technique.,talks over the camera.,talks to swim in the hand.,1
grabs her rifle and gazes on.,comes into the room to wait.,frowns at the sitting room.,watches the kids head inside.,3
retreats into the pool.,puts left to the table.,gets to his feet.,watches him walk away.,3
opens beside them.,drops his head on the head.,suddenly runs out.,pushes a box along the floor.,2
steps to an outside roof.,pushes a box along the floor.,drops his head on the head.,opens beside them.,1
grins at someone.,shoots her worried glance.,waves to the window.,is crowded in a station.,1
is crowded in a station.,coasts out of her kit.,grins at someone.,climbs a waterfront stairway.,2
looks up at him.,steps up to assist the call.,picks up someone's baby.,motions for someone to see.,0
barge into their vehicles.,surround each other as well.,play chips at a bus.,stare steadily at each other.,3
pulls a gun from his pocket.,runs into a small foyer.,peeks out in a hallway.,bites his whip.,2
walks under the lobby.,loads the handgun.,stares at the envelope.,opens his door.,2
watches his beat - up face.,looks away at the window.,weeps at her mother.,looks up at someone.,1
looks up at someone.,races out a lobby door.,weeps at her mother.,watches his beat - up face.,1
clutches a pen in his hand.,holds out her phone.,arrives ahead with a letter.,sits by a prison woman.,0
lie curled up in bed.,"sit in the kitchen, smoking.",come over to the apartment.,emerge from a dance balloon.,0
takes the phone from her ear.,stares at her clock.,peers ahead.,wipes it.,2
beats two players away.,is staring up at her.,seems a little disappointed.,notices that he is crying.,2
stands outside the cafe.,is watching them play.,is talking to someone.,stands up next to him.,2
forms a crude ladder.,sails toward his side.,smashes him against the hull.,dangles over the wound.,0
points at his fly.,gives someone to someone.,eyes his jacket and away.,glares and shakes the spear.,3
comes to help him.,returns to speaking away.,tugs at the rope.,talks to the camera.,3
swings open a car door.,dips quickly into the water.,peers at the cove display.,sits staring at a laptop.,0
rocks back and forth.,get under the water.,force open the door.,stretch out in two.,2
is added and then added.,"is mixed, mixed together.",is put into an oven.,is sprinkled over the cake.,3
smacks his stomach again.,spills out on his desk.,fom a recorder in the end.,is heard sounding on filter.,3
meets someone's glaring gaze.,kisses him across the cheek.,"hesitates, then walks away.",starts to remove her coat.,3
kisses him across the cheek.,"hesitates, then walks away.",meets someone's glaring gaze.,pours himself a drink.,3
walks down the slope.,is attached to them.,is on the grass.,is riding a raft.,3
walks down the slope.,appears on the bridge.,is attached to them.,is on the grass.,1
is parked out front.,sits on the street.,pulls back at longbourn.,goes into a garage.,0
heaves another heavy sigh.,keeps the pace on his groin.,rushes out the wardrobe.,shouts out the phone.,0
"continue to someone, centaur.",are in the car.,follow him as he goes inside.,drift back toward someone.,2
walks onto the field.,kick a ball toward his coach.,jumps off one bar.,falls onto a black mat.,0
falls onto a black mat.,throws a ball on the field.,kick a ball toward his coach.,jumps off one bar.,1
sticks his ear in.,gives him a taunting smile.,leans close to the tiger.,gives a curving nod.,2
takes a deep breath.,pulls someone around.,gives her a sly smile.,stares at the display.,2
takes a deep breath.,plants a kiss on her lips.,pulls someone around.,stares at the display.,1
lifts his hat and smiles.,trails down the group.,finds a statue of someone.,falls through his own.,0
"comes on, raising his arms.",lands on his pad.,smashes the top of the cow.,whips them with his stick.,3
fires two more arrows.,hurls him flying overboard.,takes them to the man.,comes to land with fans.,0
watches them from the water.,rides up and slows to a halt.,points a guide downward.,races down a river.,1
meet in a white water.,are dull and uninterested.,are sprawled on the floor.,clap and shout at his balls.,1
are covered with amusement.,drift slightly to prowl.,glide across her muscles.,scan around the room.,0
shifts his thoughtful eyes.,turns on the water.,looks at it and moves on.,shifts his sad eyes.,2
rolls across her groin.,wrapped around her shoulders.,is stained with blood.,piled in vests over her.,2
begin a comedian.,run away.,are on the court.,are playing the game.,3
join his machine tripod.,are in a carrier.,hover around the egg.,are limp at the credits.,2
stands up to act crazy.,on posing for the crowd.,does several hop kicks.,continue acting with people.,0
continue acting with people.,and cheers them on.,does several hop kicks.,on posing for the crowd.,1
eyes the cedar structure.,looks up into his sleep.,lifts up to bed.,climbs in next to someone.,3
get up close.,give him shocked looks.,exchange a black smile.,dance back and forth.,1
talks grandmother the phone.,writes in a notebook.,blows on the dice again.,walks down the street.,2
see the board up close again.,see a man holding a shovel.,see a title screen.,see a helicopter from a lake.,0
chucks the remote aside.,collapses onto the floor.,is lying on the floor.,turns back to his friends.,1
is pulling himself inside.,concentrates on the handle.,races into the garage.,smiles weakly on his bed.,1
are added to the counter.,sit around a pot.,come out to watch.,break up in sight.,2
lurch away from each other.,fly from the train.,riddle someone's body.,is jumped head first.,2
is waiting for them.,drops off to the floor.,slides over someone's bed.,is raised on a pole.,3
slides over someone's bed.,falls to the floor.,is waiting for them.,drops off to the floor.,1
adjusts the overnight case.,"pulls up in, hands routine.",moves toward the glass door.,gazes at her tenderly.,3
jumps on the bed.,tries to catch him.,does tricks while he jumps.,pretends to fall on a dog.,2
stands on his feet.,pretends to fall on a dog.,jumps on the bed.,tries to catch him.,0
runs up and down.,chases after the dog.,jumps on his back.,flips off side to side.,2
jump into a ball carrier.,are shown inside a gym.,runs on the track.,are inside a room.,1
is about to lie on the floor.,flings him to the ground.,shoots an arrow in the head.,waves his hands overhead.,1
put the finished clean.,dip the brush in paint.,paint using the brushes.,put them back in the paint.,2
falls to the ground.,grins and flexes his neck.,scrambles up the stairs.,leaps to the end of the book.,1
are shown in a cutting face.,are being put on the lens.,are displayed on a surface.,are continuing on her nails.,2
are shown on a hand.,are shown in a cutting face.,are continuing on her nails.,are being put on the lens.,0
rub along the water.,is pulled back down.,comes close to end.,is turning in circle.,3
does n't have it fast enough.,has barely restrained her.,tries to answer someone.,does this for her.,2
supports them.,glances at the screen.,gives him a searching look.,takes the shoe off him.,2
begins drying a girl's hair.,braid her hair.,is wearing a red blow dryer.,starts showing a cleaning up.,0
is just thinking of disco.,nearly chokes on her drink.,turns off the radio.,strolls up next to her.,1
sit politely at home.,land on an elegant beach.,go into his house.,wrap a bill in a wedding.,2
grabs the spray bottle.,lands on a branch.,keeps forcing her along.,falls heavily in exhaustion.,2
puts her hands under his lap.,sits beside someone in bed.,paces on the bed.,holds a wad of cash.,3
opens up behind them.,is at the end of them.,is pumped up behind them.,dives by on the street.,3
pass a joint around.,explode around the carnival.,go through a rain shop.,countdown through the steps.,0
begins to adjust her bags.,fills the empty glasses.,has fallen on her bed.,is thrown in a cage.,3
stares into his eyes.,turns the shower away.,is jumping in a bath.,flashes a nervous grin.,3
are watching him clap.,watching them hang up.,are watching them watching.,are raising their hands.,3
are watching them watching.,watching them hang up.,are clapping and applaud.,are watching him clap.,2
strikes directly at someone.,backs him up to someone.,looks up from his play.,aims the gun at the boys.,2
aims the gun at the boys.,strikes directly at someone.,backs him up to someone.,walks down a nearby aisle.,3
rides only slip and rolls.,falls into someone's arms.,looks up at the snake.,moves forward to curtsey.,1
looks up at someone.,leans on a wall.,"looks at him, concerned.",watches them from a garage.,2
walks over to admire it.,is oblivious to man.,sees the action boldly.,brings it to someone's pin.,0
