startphrase,ending0,ending1,ending2,ending3,label
The man plays continuously around on the drum set. He,continues to talk as he begins pressing the guitar.,continues playing the piano while the boy continues playing.,finishes playing the drum and pauses before the camera.,parts the flip and covers the equipment he made.,2
Another man on the field catches the ball. The man with the ball's team,swimming in him and cheers him on.,makes several pictures and throws a ball.,grabs a mallet and throws the ball.,is falling near the pool in attempt.,2
"Someone sits across from him, looking small and isolated. Someone",reaches out and takes someone's hand.,is soaked through very bare curtains.,puts his leg around someone's neck.,is quiet - eyed with woman.,0
"Someone sits across from him, looking small and isolated. Someone",is soaked through very bare curtains.,puts his leg around someone's neck.,"stands, ready to usher someone out.",is quiet - eyed with woman.,2
Someone's gaze is steady. His high white shirt collar and dark coat,are high and warm.,hangs on his wrists.,drops out of view.,is shaven and bald.,0
Someone's gaze is steady. His high white shirt collar and dark coat,hangs on his wrists.,is shaven and bald.,frame his stern features.,drops out of view.,2
We see a flash of an image of a standing man. We,see the hammer throw while the man jumps.,see a man walking up on the camel.,see two black guys playing in the papers.,see the man spin and throw the discus.,3
"After, the man that is in the harness grabs on to the shoulders of two men as they help him stand up on top of the bridge. Finally, the man does a free fall off of the bridge and a orange ball",comes out behind them.,falls to the floor.,is thrown to him.,falls across the ground.,2
He picks up the mail on the floor. He,"grab her by the hand, and startles someone.",leaves the loft with his mom to him.,moves away from the stained - glass window.,"falls to the ground, stomps on his hands.",2
We see men pulling and pushing a boat. We,see a person rescue a ship.,see a camera watching the stove.,see a skier in a crowded.,see people marching in a competition.,0
Someone starts hitting someone about the head with his open hands. Someone,lowers his smile triumphantly.,feels for his boots.,admires the feeding partner.,looks incredulously to himself.,3
"Someone leans into the bomb, her arms stretching toward the wire. The tip of her scissors",is set on someone's toes.,clamps down over her face.,stop a few inches away.,glows on someone's fbi eye.,2
He presents a framed arrest report. He,stares at the display.,starts to have soup.,holds it for money.,eyes the text image.,0
A video of water polo is shown in the gym. A few people watch and the ball,rolls around the island.,drops to the ground.,goes across the water.,are shown for sport.,2
A video of water polo is shown in the gym. A few people watch and the ball,rolls around the island.,drops to the ground.,goes back and forth.,are shown for sport.,2
We see a pile of sticks to the left and see a flint. The person strikes the flint and a flame,is turned from lights.,turns to the fire.,runs to the hole.,burns through the storm.,3
We see a pile of sticks to the left and see a flint. The person strikes the flint and a flame,runs to the hole.,is turned from lights.,sits on he sawdust.,turns to the fire.,2
Someone sits down between people. Someone,looks oddly at someone.,watches someone walk away.,", with his hands.",starts to record them.,0
"Someone reclines on cushions as people dance in the ballroom, which is lit by hundreds of candles. Someone spins around and faces someone, and they",turn toward the stage.,share a stubborn look.,give a passionate kiss.,enter a crowded room.,2
She sits down at the bar. Someone,closes his eyes and gives it a kiss.,shows how to curl up a new smile.,grabs her jacket and walks off after her.,comes toward the bar and takes a seat.,3
Someone stares forward as she walks away. Someone,"climbs to someone's bed, slipping, fully clothed.",runs towards the base of the snitch.,"tears off his stick, then walks away.","raises her arms, then leaves the room.",3
"Looking over her shoulder, she spies Wennerstrom getting out. As he takes out a cellphone, someone",glances across the room.,folds his makeup down.,writes on the journal.,enters a resigned sneer.,0
He stops and glances around. A chair,obscures someone from his view.,shows someone near a window.,is sitting next to him.,is shown in arm tape.,0
"Someone holds someone up as they leave the photo area. On the dance floor, people",run past a shabby bus.,carry someone on the bed.,look in and around her.,face each other and shout.,3
"He grabs her, turns her roughly. She",eyes the ledge below.,beats his arms away.,tumbles to the bottom.,knocks her husband over.,1
"With his arms crossed at his back, he regards the boys frankly. Someone",props his arm on his neck.,shakes the flask together and sighs.,turns and glares at the woman.,dries his hands and claps stage.,2
"Frowning, someone runs a hand through her mussed hair. She",eyes someone and nods.,turns to her computer.,smiles at someone fondly.,reaches for her leg.,1
"Frowning, someone runs a hand through her mussed hair. She",smiles at someone fondly.,eyes someone and nods.,glares at her father.,reaches for her leg.,2
"Players walks from the dressing rooms and are in the field playig. players are stading in line clapping at the end of the game, results",are then shown on screen.,are watching from the beach.,are shown in the end.,for the ball are shown.,2
"Players walks from the dressing rooms and are in the field playig. players are stading in line clapping at the end of the game, results",are shown in the background.,for the ball are shown.,are watching from the beach.,are then shown on screen.,0
First different kinds pool balls are shown lined up. Then the boy,hits a tennis on the wall and gets a shot.,throws a shot of water and waves to the judges.,starts to play pool all by himself with the balls.,talks while demonstrates how to be demonstrated by demonstrating sports.,2
We see a man talking to the camera while holding an accordion. The man then plays the accordion and we,see the screen looking on.,see the ending title screen.,see some of the band.,see a man playing guitar.,2
A woman is sitting at a desk. A man sitting in front of her,is playing a harmonica.,stands on her desk.,trying to block something.,is throwing a cat.,0
She hands another racket to a friend. She,snatches up a phone.,is not really playing.,runs out of frame.,drinks some more whiskey.,1
"Someone, dressed in dark trousers and a pale cream shirt, waistcoat and skullcap emerges from a doorway. He",walks through the market.,goes to a cooler.,blows on the trigger.,finds a vulnerable face.,0
"Someone, dressed in dark trousers and a pale cream shirt, waistcoat and skullcap emerges from a doorway. He",goes to a cooler.,finds a vulnerable face.,blows on the trigger.,disappears down the stairs.,3
"He reaches in his pocket, then remembers that he gave his money to someone. He",stares at the broken boy.,stands and glances at it.,slumps over onto the ground.,turns sideways to face her.,3
"Someone reaches the doorway and is suddenly brought up. In the shadows, someone",sits by someone's mat bed.,sees someone glancing at her.,lands slumped in the bed.,comes running deeper and closer.,0
Two people are dancing in a room. They,engage in bouncing music and playing.,are dancing together in the room.,are dancing and dancing with flowers.,spin around on the dance floor.,3
"He falls to one side. Someone, the nurse,",stares at his attacker.,watches his father leave.,runs into the street.,stops to attend him.,3
Someone's mouth hangs open and she shudders. Her lips,spread into a wider smile.,tremble as she finds words.,spread into a little smile.,parted into a serene tangle.,1
Someone's mouth hangs open and she shudders. Her lips,spread into a wider smile.,parted into a serene tangle.,spread into a little smile.,spreading into a gentle smile.,3
The young boy then moves in the middle taking turns with others dancing around. Another man,stands in front of the girl and begins to talk.,walks onto the stage while the other woman continues talking.,is shown jumping in circles as the other boy moves.,jumps over a bar of four shorts and does flips.,2
"The men take one wave after another, their boards cleanly skimming the glassy water beneath their feet. Someone's shoulders",heave as the women congratulate each other.,ripple as he heads over the wave.,heave beneath his helmet as they approach.,heave as he takes in the spectacle.,3
A piano player plays the piano. She,lays her head on one hand.,waves and bows at the crowd.,turns off and claps her hands.,pauses to break her shoulder singing.,1
"Someone sees an open window. A muzzle flash illuminates the window, and someone",looks hard at twigs.,sees his pistol nearby.,reels back before falling.,passes on behind her.,2
A man is seen speaking to the camera while holding onto a stick. He,"falls into the center, then is seen bending down in front of him.",moves all around the wall as more clips are shown of him playing.,points down to balls in front of him as well as his body.,is sitting down in the grass while the camera pans around the woman.,2
He stares up at the ceiling. Someone,steps out onto the balcony.,"steps from someone, who smiles.",wears a smooth red outfit.,nods and lifts his glass.,0
A group of girls are standing in a gym. They,are swinging on a rope in a competition.,attempt on a mat and begin jump roping.,are doing a routine for the crowd watching.,are doing a cheerleading routine in a crowd.,2
"The elevator opens and someone and someone spill out, almost running into a steward. Someone",is holding his gun.,spies someone with someone.,sorts through the throng.,sprints across the road.,0
"He leans against the barn, then glances back at the house. He","glances at her, anxiously.",enters in the kitchen.,crosses to an door.,gives a mischievous grin.,2
A man is sitting on a couch drinking a beer. He,puts a cigarette in his mouth.,raises the drink in his hand.,is lifted up and kiss someone.,puffs into the cigarette then exhales.,1
Someone appears wheeling a barrow. Someone's sword,falls off his back.,has caught the flagpole.,falls from the eagle.,comes out in flames.,0
A woman is talking in the front yard. She,starts cleaning the table and kneels down.,is pushing a lawnmower in a backyard.,is pushing a bucket across the lawn.,is showing how to wrap a basket.,1
A second bird flies to his other hand and they put lights on the tree. The young man,opens a lion's cage.,turns a hand knob.,rubs the bird's head.,falls on his feet.,2
They compete intensely at a fast pace. The man of the red team,wins all four times.,takes a five score.,is acting so comfortably.,does a big jump.,0
They compete intensely at a fast pace. The man of the red team,does a big jump.,takes a five score.,is acting so comfortably.,runs towards the goal.,3
The family enjoys eating the desert together. The people in the restaurant laugh at the man and he,starts cooking with the children.,wonders what they are doing.,gestures to her eating it.,returns one with a chicken.,1
Someone sweeps someone out of their way. The incorporeal figures,remain out in the cockpit.,begin to appear and halt.,disappear above the bridge rail.,sit petrified on their necks.,1
"Pausing, the human team members turn. He",starts to assist him.,drinks and conversing politely.,gives a new one.,gazes at her lovingly.,0
The Gryffindor supporters are ecstatic. The Slytherin captain,puts down the kindly tea.,"marches off, craning his neck.",joins her on the stage.,aims again for the goal.,3
He plays hopscotch to pick it up. A little kid,makes some steps inside a home.,catches a green on a playground.,runs around in front of him.,plays ice cream in the clear.,2
Meet is placed into a pot. vegetables,are added to the pot.,are put into the oven.,are added to the pasta.,are added to the meat.,0
She bangs her head on a lamp above her. She,is finished for her trip.,is nowhere to be seen.,advances dimly illuminating her cigarette.,puts down two heavy bags.,3
A boy is talking in front of a camera in his room. He,"smokes a cigarette, then blows the smoke from his mouth.",went down and apparate about tall bushes and watching him.,uses a knife through tools on top of the bushes.,shows a text message to the camera from the camera.,0
He tugs out more weeds. He,grabs it and tugs off.,draws himself to his feet.,is hurled over a roof.,smiles and carries on working.,3
They travel on an under ground railway. The goblin guide,gets to the feet.,gets off the train.,gallops along the snow.,them in their wake.,1
A woman is shown leaning against a wall. Several ballerinas,are out on the screen.,are shown in the water.,are playing in a park.,are shown in a room.,3
"He gives a thoughtful look. Now wearing his suit and jacket, he",scurries down some stairs.,carries a trash bag.,uses an outdoor mirror.,leans in a mirror.,0
A camera is seen moving closer to a playground and shows a woman going down a slide. A dog rides down with her and another dog,runs past a person.,chases after the baby.,comes out the view.,pass behind the girl.,0
A camera is seen moving closer to a playground and shows a woman going down a slide. A dog rides down with her and another dog,comes out the view.,pass behind the girl.,chases after the baby.,walks around the area.,3
Someone faces Blond who returns his gaze remorselessly. Someone tosses the notebook over and it,heads back to someone.,drops on the table.,shows someone standing up.,rises on the table.,1
Someone faces Blond who returns his gaze remorselessly. Someone tosses the notebook over and it,shows someone standing up.,heads back to someone.,lands in the dirt.,rises on the table.,2
A man is throwing darts inside a room. Another man,is throw darts in a field.,enters and approaches a dart board.,is throwing darts in the camera.,is throwing darts at a dart.,1
The black shiny surface on which he is lying begins to crease and sag. Water,rains down on him.,arms are now carved.,flicker on the bottom.,picks up another oar.,0
"She puts down her bag, reaches for the binoculars, takes them out the case. She","comes down the stairs, brings them to him.",walks to the bathroom in her modest kitchen.,"unwraps it, then tosses it aside and leaves.",opens up and turns back toward the entrance.,0
"A soldier kicks one of the cripples who can't go on any more. Then a whistle blows, a policeman stops the traffic, the barrier swings open and people",sprints thoroughly about high speed.,pass for the opposing team.,get stuck to the bottom.,swarm across in both directions.,3
The station is visible about sixty yards away. Ten or twelve cars,are parked until the door lights out.,are tossed in by a violent someone.,are on either side of the road.,stand and run out into the snow.,2
"People are conducting a bond rally from the top of an Army tank. Someone, in uniform,",runs to his front door.,sits slumped on the ground.,jumps up and gets out.,stands by a policeman's poster.,1
"People are conducting a bond rally from the top of an Army tank. Someone, in uniform,",runs to his front door.,stands by a policeman's poster.,jumps up and gets out.,moving cautiously with fixed bayonet.,3
"Someone hurries up to meet him. Handing someone the gun, someone",runs off to investigate.,shoots an elegant look.,appears out of sight.,takes out her sawed.,0
Someone makes a left turn into traffic. She,walks into another pawn shop.,scans the busy intersection worriedly.,come in front of them.,walks farther towards the restaurant.,1
Someone clutches his bleeding shoulder. Someone,turns and sees us.,massages his own hand.,drops his torch again.,stands in a corridor.,1
Two girls are standing on a grass field. One of the girls,notices on the grass.,starts doing cheerleading moves.,holds her elephant paws.,turns and bumps forward.,1
"Now, on a basketball court with a row of treadmills at one end, someone rides a bicycle in circles. He shoots the basketball from the bike and it",lands over the block.,goes through the basket.,bounces off the floor.,goes to the bottom.,1
He takes swigs from a liquor bottle. A catch of junk,appears on the prow frame.,jumps out of his eye.,is dumped onto the deck.,skateboard hangs over the automaton.,2
"This video shows 9 different ways humans can do the monkey bars. This woman is wearing a tank top, leggings, and gym shoes and she",does n't get it to go.,does it the regular way first.,does n't like to be tall.,can't see what they are doing.,1
Someone shifts her shocked gaze. She,lowers them to her eyes.,moves down the serving line.,"collapses, holding her brother's sigh.",lies back on her laptop.,1
A crowd of people is watching them. A person in a red shirt,is sitting across from them.,walks up next to them.,is sitting down watching them.,seems to be playing shuffleboard.,2
She nods at the phone. Someone,stops on the tracks and looks away.,picks up the phone and turns around.,picks up her coffee and notices them.,"shrugs inanely, then bows to her daughter.",1
"He steps through the arched gate and crosses a narrow street, where he meets Rene someone. Someone",takes off the white ocean cloak.,steps up to someone front door.,spots someone at her front door.,leads someone down a sidewalk ledge.,1
"Glancing over, someone thrusts his middle finger toward someone. Someone",rolls to a halt.,disappears at a distance.,unhappily strokes someone's cheek.,advances in the suv.,3
"There are several spectators and judges watching him perform. After the man finishes his stunts, he gets off the stilts and the judges",go over the bar.,write down the scores.,are being interviewed watching.,comes over to him.,1
She swings her arms and thrusts her hips. He,looks down at someone.,lands on the mat.,"has long, dark hair.",hands down his arms.,0
Grainy footage of him getting zapped. Someone,stares at the bird.,is into troubled construction.,somersaults towards the splayed.,has the a policeman.,0
Their pursuer tries to work out where they've gone. She,pulls the van down to the ground.,"pouts sexily, and gestures to the case.",pulls out a stone from a shed.,swerves through a brief explosion of water.,1
"Later, they approach the clinic together. Someone","turns back to someone, brow creased.","freezes, staring up at the automaton.",uses a flashlight on his computer.,crosses his cubicle and sits up.,0
"Someone shifts his confused stare. Downstairs, someone and someone",lie curled up in bed.,"sit in the kitchen, smoking.",come over to the apartment.,emerge from a dance balloon.,0
The little boy walks away smiling. The boy,comes to help him.,returns to speaking away.,tugs at the rope.,talks to the camera.,3
And they head towards a waiting car. Someone,swings open a car door.,dips quickly into the water.,peers at the cove display.,sits staring at a laptop.,0
"In the woods near a high bridge, people find an old ranger hut. They",rocks back and forth.,get under the water.,force open the door.,stretch out in two.,2
A person falls out of their raft. A man holding a selfie stick,walks down the slope.,is attached to them.,is on the grass.,is riding a raft.,3
A person falls out of their raft. A man holding a selfie stick,walks down the slope.,appears on the bridge.,is attached to them.,is on the grass.,1
He opens the door for her. Someone's minivan,is parked out front.,sits on the street.,pulls back at longbourn.,goes into a garage.,0
She opens her coat and touches her belly. Someone's clear blue eyes,are covered with amusement.,drift slightly to prowl.,glide across her muscles.,scan around the room.,0
"A man is very concentrated playing pool, while two men and a lady have a conversation behind him. He joins them in the conversation and they",stand up and talk again.,are very embarrassed by someone.,are having a good time.,'re putting the sunscreen on.,2
Someone puts his fingers around the bony thumb. The hand suddenly,rises from the tattoo.,crawls onto his breast.,"closes, clutching him tightly.",peaks into someone's glass.,2
Woman is in a shower spreading soap and water in her arms. woman,is running in front of the sink.,is wiping a sink with blue towel.,is shaving a woman's chest and ankles.,is shaving her legs on the bathtub.,3
"A man in white shirt and white lifevest is sitting in a single orange raft. The man in a raft is going against the water waves, he paddles and the raft",rub along the water.,is pulled back down.,comes close to end.,is turning in circle.,3
"He carves up the wave, descends to the base, then rides up the face for another turn. Someone","allows the white water to surround him, then crouches low and glides out of it.",crosses to the landing on the far edge of a platform and to his platform.,"dangling, as he makes his way over a small stone bridge onto the ground below.","takes the leap through the air and runs out, it soars over the city below.",0
"He leaps onto his horse and they charge off. Someone comes running into view, still dragging someone, who sometimes stumbles, but he",grabs the spray bottle.,lands on a branch.,keeps forcing her along.,falls heavily in exhaustion.,2
People are dancing on a stage. People in the audience,are watching him clap.,watching them hang up.,are watching them watching.,are raising their hands.,3
People are dancing on a stage. People in the audience,are watching them watching.,watching them hang up.,are clapping and applaud.,are watching him clap.,2
"As the train disappears, he sees someone standing in front of a billboard advertising Divine Magic Perfume. Someone","slows down, looking about from four times.","glares at someone, who stands opposite someone.",read first; through some empty square stacks.,releases a cord attached to his ankles.,1
"As the train disappears, he sees someone standing in front of a billboard advertising Divine Magic Perfume. Someone","slows down, looking about from four times.",takes it then fastens down his blouse.,smiles and crosses over to join him.,releases a cord attached to his ankles.,2
A man sits at a table and a woman moves a box from him. He puts his hands on the table then,assembles the knife up in sharpener.,turns to look at the camera.,takes a drink with a pen.,puts other silver photos in it.,1
A man sits at a table and a woman moves a box from him. He puts his hands on the table then,puts other silver photos in it.,assembles the knife up in sharpener.,begins to solve a rubix cube.,takes a drink with a pen.,2
We see the cameraman's shadow. A person in blue,is mowing the lawn.,runs to the tree.,walks past on screen.,comes next to him.,0
"As someone steps away, someone's glare follows him. He",brings the gun upward.,looks into someone's hand.,knocks on a tree.,looks over her shoulder.,3
And he brushes it away. Someone,"stares, slack - jawed.",allows a faint smile.,gives a mailbag wink.,gives quick and fluffy.,1
Someone leans into view with wide eyes. He,unwraps her tac then tosses it off.,crosses a white table with long shadows.,"slips inside, then creeps to an alcove.",shows the list of heavily guarded spiders.,2
A lady does a split on the floor and they finish. The ending title,replay over 2 clips.,comes at the screen.,plays on a screen.,appears on the screen.,3
They share a little smile. She,gazes at his distant reflection.,glances around then hurries off.,looks down at his hand.,gives them a better look.,2
Someone punches the hysterical man in the face until he releases someone. Someone,steps away from them.,nods toward the crowd.,stares at the sky.,shoots at his rat.,0
"A smaller boy runs on stage, confused. A man with a microphone",is playing a white flute.,is standing against his tree.,talks to the young kid.,walks closer to the title.,2
Someone wends his way through the dancing couples toward a supper table. He and someone,are carrying plates and pies.,give each other high fives.,step into a swimming pool.,are out of their way.,0
"Although he is not the vibrant man we've seen before, it's not as bad we feared. The illness","has been quick, and left him largely intact.",is completely extreme outdoors for cub past words.,do it a third time before they finish.,comes with details come out of someone's mind.,0
Someone wakes him and rises primly to her feet. She,rocks and leaps across the fallen victim from another angle.,"steps out into the hallway, blowing dust into his bedroom.",is approached by women in white uniforms and nurses' hats.,plants a kiss on the top of her clenched legs.,2
We see a lady talking to the camera. The lady,puts the contact lens in her eye.,buy places and cuts a toy cake.,stands at the end of the stairs.,puts the contact lens in his eye.,0
"He ducks a thrown rock, which smashes into a statue. Someone",takes the silver and gold.,drops into the white tower.,runs toward the open door.,points fearfully at a statue.,3
"Someone stares at someone, who taps a fist on the bedside table. Someone",looks over her shoulder at someone.,loses his expression as everyone steps.,ignores her and shifts restlessly up.,lobs the rubik's cube to someone.,2
"Someone races across the Wooden Wharf, followed by the ringwraiths. He",goes to the staircase.,turns on the spot.,leaps into the ferry.,begins to crumble together.,2
"Prawn someone wears a hospital gown and scrub bottoms as he races over a hill beside the highway. Some garbage, finds a trash bag and",drops it on the ground.,strikes one with the basket.,starts motocross toward the cop.,opens the door to someone.,0
"Someone buries his face in her shoulder. As she pulls away, he",leans forward and kisses him.,kisses him on the cheek.,holds on to her hand.,"finds her naked, watching hungrily.",2
