ending1,ending2,ending3,ending4,label
shines in his window.,blinks away from his gaze.,shines from someone's heels.,shines through his window.,1
is riding the camels.,run around the track.,move off in the hold.,step off of them.,3
ducks and tilts his drink.,falls to the board.,hands someone the bottle.,kicks it in the pool.,2
looks down at someone.,starts to pierce his visor.,pulls the hood off the tree.,sits in place beside him.,0
make a u - turn.,turn to get on someone's bed.,enter a deserted classroom.,make out on a couch.,3
join her and stop.,have sex in his bed.,run through a dance hut.,cross on the main road.,1
hesitates and aims his gun.,sits at a work table.,joins him in bed.,rolls over on a fallen bench.,2
stand side by side.,join her and stop.,cross on the main road.,run through a dance hut.,0
gazes up at his father.,looks down at the baby.,turns to the window.,reaches out for a kiss.,2
finds her car parked.,wipes her brow again.,follows both of them onboard.,smiles at her boss.,1
gathers up a book.,walks up to her motorcycle.,smiles and runs off.,'s eyes meet hers.,3
steps up behind him.,crosses someone's bullpen.,turns and glares at him.,stares at a tall statue.,0
stares at a tall statue.,looks down at someone.,crosses someone's bullpen.,turns and glares at him.,1
stand outside in a short row.,run again in the background.,walk into the woods and race.,are running across and muddy.,0
is mowing the lawn.,runs to the tree.,walks past on screen.,comes next to him.,0
claps a hand above her mouth.,slides down to the end.,slides him down beside her.,pulls him up in the elbows.,1
speeds back into the street.,slides down as she stops.,breathes in on their mother.,knocks the gate off.,1
are lined up with color.,are along the sidewalk.,are buffeted by the memory.,are covered with dried blood.,3
goes through the parking lot.,climbs over the cliff.,climbs into the abyss.,walks up various hills.,3
is dragging a wavy stone.,gives someone a warm hug.,approaches the guest desk.,gets into someone's tie.,1
brings the gun upward.,looks into someone's hand.,knocks on a tree.,looks over her shoulder.,3
spits on the glass.,starts vacuuming on the rug.,shines them on his finger.,presses his hand to his head.,3
"stares, slack - jawed.",allows a faint smile.,gives a mailbag wink.,gives quick and fluffy.,1
see a sped up screen.,see the person in black.,see the lady comb her hair.,see the title screen.,3
return to the fish.,begins to move around.,holds out the green hand.,puts on new caulk.,3
faces a bounty guard.,shakes someone's hand.,dangles against the tree.,hauls her away and reaches.,1
turn from the side.,stare at the preteen woman.,sit behind the kitchen table.,approach with a slow grin.,3
sit in the upturned armchair.,share the boards with a toy.,rake their boys robes.,share a disheartened gaze.,3
eyes it with a smile.,pulls on his mask.,rushes into the car.,gets out from his car.,3
replay over 2 clips.,comes at the screen.,plays on a screen.,appears on the screen.,3
lowers a winding whip.,slides down for a moment.,reappears on the scene.,gives a great sigh.,3
watches a news report.,begins to write on the piano.,holds up a check.,looks up at the suspect.,2
falls over onto the ice.,is moving from behind.,pushes a ball into a net.,in a red shirt throws a ball.,0
falls off the beam.,lands on the mat.,backs away from the beam.,jump over the pole.,0
scans several tables at them.,stumbles toward the vehicle.,aims a pistol at everybody.,ducks closer to the street.,1
steps back and looks around.,studies the burning bravely.,tries to get it away.,aims his weapon at someone.,3
lists tips and bows.,the word sexy someone.,thank you as she leaves.,lifted a tooth.,2
's gaze drifts to his eyes.,looks across the chalkboard.,catches up with her.,"bows, purses her lips.",2
"bows, purses her lips.",'s gaze drifts to his eyes.,looks across the chalkboard.,give a shit affirming salute.,1
comes in in someone's eyes.,comes onto someone's mind.,comes onto the screen.,appears on the woman's face.,3
comes over someone's face.,comes in in someone's eyes.,comes onto the screen.,comes onto someone's mind.,0
sinks down from the dumpster.,draws her gun back.,enters an art gallery.,hops off from the cable.,2
is a cloud of dust.,is visible in the cold air.,rises in a burst of giggle.,forms a brief pout.,1
steps away from them.,nods toward the crowd.,stares at the sky.,shoots at his rat.,0
"nods, almost smiles.",goes down a tunnel.,pulls up his pants.,is only his own.,0
excitedly faces the stairs.,runs through the office.,hands over the letter.,looks at him in frustration.,3
smiles at his work.,blows out a tune.,stares hungrily at her.,"wears a dull, dark dress.",0
meets his nephew's gaze.,touches her forehead to his.,gives him a high five.,has her back to his.,3
touches her forehead to his.,returns a tender look.,gives him a high five.,meets his nephew's gaze.,1
of the house is occupied.,"is there, mopping up.",is locked on the counter.,'s bedroom is dead.,1
is playing a white flute.,is standing against his tree.,talks to the young kid.,walks closer to the title.,2
is shown in close up.,is used to be hit by mixer.,is seen on the table.,lifts less than the minute.,0
are carrying plates and pies.,give each other high fives.,step into a swimming pool.,are out of their way.,0
completely from his journal.,is pressed close to hers.,holds him under the tank top.,reaches under his shirt.,1
looks at the glowering sky.,turns quizzically at someone.,looks around his guard.,eyes the lcd screen.,1
carry him a body of coal.,enter a department store.,hide behind a kiosk.,pull someone open a bathrobe.,2
pull someone open a bathrobe.,enter a department store.,carry him a body of coal.,enter a bank's chamber.,3
take the people off.,engage in a cardio doing it.,do screams and falls.,end in the air.,3
take the people off.,engage in a cardio doing it.,helps him back up.,do screams and falls.,2
covers the egg with a napkin.,returns to the sink.,stops in her tracks.,slowly climbs the stairs.,3
whips out lighter fluid.,picks up one of the halves.,sticks it in his left palm.,lands in a bin.,1
whips out lighter fluid.,sticks it in his left palm.,lands in a bin.,lets he fall to the ground.,3
hugs her to him.,nods and gives a puzzled nod.,looks hard at the screen.,gives a powerful nod.,0
starts down the fence.,gets up and begins urinating.,drops onto a wooden platform.,starts playing a saxophone.,3
takes the silver and gold.,drops into the white tower.,runs toward the open door.,points fearfully at a statue.,3
is doe - eyed.,pulls him into his car room.,knocks on a cake.,peeks down the stalls.,0
goes to the staircase.,turns on the spot.,leaps into the ferry.,begins to crumble together.,2
watches someone's car.,gives a thumbs up.,turns and walks out the room.,peers down at him gently.,2
walk by on the street.,sit outside by a zoo.,are asleep in a bed.,eat near the fountain.,0
goes down the snow.,walks down into the monkey.,looks at the black.,has a white trophy.,0
encounter each other.,flops and they leave.,gets caught on the rope.,laying the paper out.,2
are placed over the mix.,are added to the bowl.,are added to the cake.,is spread into a mixing bowl.,1
opens the door partially.,leans on the front door.,creeps up behind him.,comes into the house.,2
pushes the cashier's board.,puts one tooth on his cheek.,follows the others out.,nail it on.,2
begins to braid her hair.,uses an exercise phone.,kneels down in a room.,plays the bagpipe on a table.,2
begins to braid her hair.,plays the bagpipe on a table.,uses an exercise phone.,cleans snow off a car.,3
are dancing in a car.,ski inside the warehouse.,talk to the camera.,help it out of the car.,2
beats on a double - monitor.,smacks over the boat tank.,plummets in the process.,sticks up and is bandaged.,3
get injured on his cables.,is hauled around the table.,faces the mat reluctantly.,rests it on a monitor.,2
is covered into blood.,plummets in the process.,smacks over the boat tank.,beats on a double - monitor.,0
hits his cubicle closed.,beheads the guy around alone.,get injured on his cables.,is hauled around the table.,3
turns to face him.,stands holding a sheet.,looks up at someone.,leads someone to the door.,2
falls on someone the boy.,is blown into frame.,is retrieved from the slot.,lands behind the back.,2
looks at him nervously.,nods to the chief.,sets down a controller.,sits a few paces away.,0
hits the ball in the court.,is standing on the ground.,is standing next to them.,is walking at the ice.,2
duck a hail of bullets.,continue on new york.,race out someone's gym.,collide and land in midair.,0
meets the penguins squarely.,honks his horn furiously.,aims at someone's hand.,searches for alien effects.,2
"tackles the car, killing him.",hits him to the ground again.,twists someone's throat.,emerges from the tank's rear.,3
grins at her once.,manages to vomit away.,"glances at him, bewildered.",bounces up from his chair.,2
searches for alien effects.,honks his horn furiously.,hands someone a few drinks.,meets the penguins squarely.,1
shoots him with a glare.,takes someone's hand.,goes up and down the stairs.,stares with a high brow.,1
nods and gazes around.,shoots him with a glare.,looks at someone's tablet.,goes up and down the stairs.,2
holds up a portable radio.,goes up and down the stairs.,nods and gazes around.,shoots him with a glare.,0
is pressed against his mouth.,returns to the priest.,slides to a pocket.,rubs his chin and forehead.,0
shake with a sad smile.,rubs his chin and forehead.,slides to a pocket.,returns to the priest.,2
begins playing the violin.,is playing a violin.,is twirling a baton.,is playing a flute.,2
grabs agitatedly off the bar.,turns to someone again.,waves to the doctor nearby.,squints with a pensive stare.,3
takes out his last cigarette.,sits at the table.,begins writing as he bows.,hoists her onto his ruefully.,1
are shown with the contents.,are laid out on a table.,are laid out next to them.,pops on top of a counter.,2
speaks to the camera.,is shining her shoes.,is pushing a trashcan.,is holding a roll of dough.,0
"nods, gets up.",squints at the car.,sits and leaves the room.,heaves a sigh with relief.,0
crouches by the chair.,squints at the car.,heaves a sigh with relief.,sits and leaves the room.,0
goes over to someone.,reacts to the applause.,hangs over his cell.,spots a map envelope.,0
gives a thumbs up.,takes the cats paw and paw.,releases the stuffed animals.,stops and sets the tin down.,1
records what is happening.,points to the container.,wiped his shirt again.,throws some other products.,0
ride on the suv.,sit on a hilltop.,stand in the sidewalk.,creeps up behind them.,2
sit on a hilltop.,ride past on bicycles.,gather in the highway.,ride on the suv.,1
kisses someone on the cheek.,puts his paper inside.,hangs up the phone.,smiles at the boy.,0
coast their fingers together.,start to work out.,gaze into each other's eyes.,swarm closely behind them.,2
cuts to a stop in the room.,appears in the foreground.,drives through a wooded area.,reverses into a little patch.,2
jumps on the bar.,performs tai chi on the beam.,dances on the screen.,runs on a skips and past.,2
sits a jump rope ball.,is clapping for them.,starts to play the drums.,throws a plate at the stage.,1
does on the parallel bars.,tries another enter the cube.,hits a white ball.,attempts the same thing.,3
takes her gun to someone.,struggles among the lovers.,wears a mask of yellow.,dives after a punch.,1
is serving.,hands to the goal.,runs back into the sky.,bounces into the air.,3
hands to the goal.,runs back into the sky.,goes through its target.,is serving.,2
throws at his brother.,holds someone's shoulder.,closes his eyes and turns.,kayaks down the road.,2
smiles as he walks off.,reaches her hand in the air.,shifts back on her shoulder.,puts her arm over her head.,0
fly out of their sty.,flit from the wall.,explode in the clearing.,pick through the garbage.,3
cower their seats.,focus on a tray for hiding.,dance between the game.,ride down an alley.,3
jumps to his feet.,wrestles someone to a mat.,goes into camp behind him.,jumps on the ladder.,3
sprints down the track.,dashes into the van.,skulks after the bus.,leads someone by the hand.,3
wrestles someone to a mat.,goes into camp behind him.,lifts himself into the air.,sits down and glances over.,0
checks under empty desks.,waves to the boy.,sits on his desk.,kisses someone's forehead.,0
turn to the stop.,watch from the back room.,perform in the court.,are mixing in a golf match.,1
is cross - legged on a wall.,"is lying on the bed, back.",runs into the dressing room.,plays piano on the bank.,2
is now sleeping on the sofa.,holds out their hand.,lifts his eyes to her.,kisses her on the back.,2
sprints away as dumbfounded.,goes into her kitchen.,is afraid from them.,shakes someone's head.,3
begins to warm brown.,scurrying for a corner.,covered in wet sand.,is pulled into a white row.,2
climbs the board and surfs.,gets the egg in the sink.,stops the sail once more.,swims all along the surface.,0
gets a gold trophy.,brings a new match.,adds the newscaster's hands.,goes to the bottom.,0
strides off with people.,puts it out and peers inside.,stares at the bag.,pulls open the box.,0
gazes deeply into his eyes.,punches him in the face.,faces the second floor.,lies face down with someone.,0
steps up to another curtsy.,bursts into the undergrowth.,quietly shakes his head.,is sitting on a chair.,3
watches from the airport.,grabs him.,looks at his utensils.,and her friend join in.,2
cranes her head to face.,turns back of the ladder.,strides to the floor.,throws on all the switches.,3
walk by on a lorry.,walk in also.,jump jump and cheer.,stand on the curb.,1
holds a gun to someone.,rides out of its dusty van.,hangs off away in the rain.,drops him off on the roof.,0
fold over.,forms a closing list.,is interviewed by sun.,opens the bathroom door.,1
are standing.,continue jumping.,do a slack flip.,fall onto the ground.,3
are standing.,continue jumping.,run to help him.,do a slack flip.,2
looks someone in the eye.,walks again to a door.,sets down the receiver.,walked out onto the street.,3
puts on his spectacles.,enters and joins her.,ventures anxiously on him.,hands him the pager.,1
enjoy the outdoor ceremony.,peer out through the gallery.,watch a tv outdoors.,pose with two teammates.,3
drives someone's car.,climbs into her sedan.,steps into a cave.,joins someone in bed.,0
slaps out of their books.,reaches out her hand.,cuts out a server.,peers a liquor bottle.,1
slaps out of their books.,sets up her throw.,cuts out a server.,peers a liquor bottle.,3
can't move on on.,run towards the shore.,breath a sigh of relief.,are slumped on the roof.,2
is talking at a piano table.,throws a dart at a board.,is walking on a slack line.,walks cards on the table.,1
holds up a pistol.,rises from the table.,pauses to stop behind him.,blinks on another hat.,1
demonstrates a red ensemble.,flags down into the chairs.,grabs a gun and starts off.,looks in the cockpit.,0
is drinking from his own cup.,flags down into the chairs.,grabs a gun and starts off.,looks in the cockpit.,0
walks down a corridor.,stares at both of them.,saunters down a quiet street.,goes into the salon.,0
saunters down a quiet street.,goes into the salon.,stares at both of them.,presses his lips together.,3
winces at her t - shirt.,"stands there, terrified.",stands on top of someone.,swigs on the phone.,1
drags on the orange cases.,takes the bag and opens it.,shrugs someone's hands.,smiles at the ravers.,1
gets out of someone's car.,enters and offers a knife.,hikes down a wall.,walks into the room.,3
gets out of someone's car.,manages to release his guys.,enters and offers a knife.,hikes down a wall.,0
stops the meager total.,drives away from them.,lets the national anthem.,climb off the train.,1
sway into a fight.,are there for them.,shoot up into the night sky.,walks on the wall.,2
drive off down the highway.,look anxiously at each other.,are full of cars.,"sit frozen, shaking his head.",1
has her hand on a swing.,uses a stepper to exercise.,lifts up a rock.,slaps at the foot of the bed.,1
"elves, at the river.",share a slight smile.,share a tender stare.,share a quick glance.,2
get out of the lift.,share a fearful glance.,"elves, at the river.",share a slight smile.,3
studies new york's shower.,drops a pill in a shoebox.,works as his mother.,arrives at the door to knock.,3
run after the finish room.,run back to the teens.,continue in the grass.,line up and bow.,3
fall to the ground.,remain locked on it.,turn to make a sultry orange.,look up ahead of the cattle.,0
swings and misses.,falls flat on her butt.,pulls the camera around.,moves out of the way.,3
follows him over to the bed.,looks up in confusion.,can't hear any longer.,holds a magazine in his hand.,1
is wild with horror.,partly hidden in shadow.,is covered in ash.,surges beneath a wave.,1
gives a mocking smile.,gazes tenderly at someone.,laughs and hugs her father.,runs across the street.,2
drives on the ski set.,enters wearing a black dress.,starts to finish the scene.,holds the cake stick.,1
turns on a lamp.,lies in his bed.,pulls off his hood.,jumps into the room.,1
smiles and bows her head.,gives a troubled look.,stares slack - jawed at her.,nods with a frown.,3
glares at one another.,even look around on someone.,shake each other's hands.,quickly work out together.,0
gives an imploring stare.,marches toward the bus.,ambles over his bed.,heads out a wooden gate.,0
reaches for a tech carrier.,combs someone's hair.,goes to his carriage.,ushers someone down the line.,2
reaches for a tech carrier.,ushers someone down the line.,combs someone's hair.,gives a big smile.,3
prays the items in her apron.,runs out onto the patio.,scrutinizes the younger man.,points his large fists.,2
fall out onto the pool.,lie on top of the sheets.,rock out of the ring.,share a long look.,3
rock out of the ring.,lie on top of the sheets.,fall out onto the pool.,climb on bikes and ride off.,3
speak to the camera.,come to the door.,are watching them.,get out of a car.,3
holds up a bottle of tequila.,eyes him with sad eyes.,takes a seat on the floor.,sits in a small boat.,2
starts to walk up the aisle.,plays the audio file.,runs towards an artists desk.,lowers her tearful gaze.,1
exit from an ejects court.,are cleaning the offices.,search the skirts of the bed.,stand inside the living room.,1
starts to open the box.,puts it in his pocket.,begins to shimmy on the mat.,reaches into a pocket.,3
snaps his eyes open.,stops and closes his eyes up.,"rises, spins in his sleep.",gets stuck in his raft.,0
pulls a raft near the lake.,is at a waterfall.,ride down at a river.,runs through a rapids.,1
is next to them.,runs through a rapids.,ride down at a river.,pulls a raft near the lake.,0
sits horrified then enters.,pulls back the kiss.,gathers up her sweater.,looks at him in disbelief.,3
move to the ground.,try to feed her.,swarm out into them.,turn to stare at something.,2
touch with an wry smile.,meet a tender tender kiss.,"meet, gazing at each other.",meet in an elegant kiss.,1
go at the same time.,continue to smile and kiss.,flip out of the raft.,scramble to dance again.,2
smiles and twirls away.,pulls his equipment tighter.,closes someone's eyes.,glances at the woman.,3
moves his index hand back.,closes someone's eyes.,pulls his equipment tighter.,smiles and twirls away.,3
sits on a sofa in her room.,clutches her own neck.,puts his hand on her back.,"smirks, shaking his head.",2
sighs and stands up.,clutches her own neck.,sits on a sofa in her room.,stretches out her finger.,0
has someone go and serves.,knows what he has done.,flips the ugly rodent clear.,gives someone a drink.,2
squeezes someone's hand.,leans low beside a lantern.,leans in back affectionately.,reaches out towards someone.,3
is running through the woods.,"sits up to her side, smiling.",is in the end window.,jerks it toward her face.,3
raise their arms and kiss.,"stand, facing each other.",sit down from the stove.,lie asleep on their bed.,1
lie asleep on their bed.,raise their arms and kiss.,sit down from the stove.,step out of the room.,3
monitor the glowing inn ring.,pass a convoy of data.,reach a twelve degree level.,see students and staff.,3
walks down a staircase.,throws himself to his feet.,lowers the bar to his chest.,climbs up the hill's edge.,2
returns to a military suv.,points at the screen.,slaps the back of a car.,walks up to someone.,0
sits up and smiles.,sinks down onto the step.,wears a school blazer.,hits the glass closer.,1
looks up from his manuscript.,opens the bedroom door.,puts his hand on her arm.,holds his lips close to hers.,2
leaps at the door.,gives her a grateful smile.,gazes solemnly at her son.,glances into her eyes.,1
is only inches from its ear.,rests on her back.,is resting on a pole.,is growing on the ice.,1
gazes solemnly at her son.,glances into her eyes.,looks lost in sad thought.,leaps at the door.,2
puts a plate in the oven.,firmly look at hand.,stands next to her.,walks slowly toward someone.,2
come someone's way.,are addressed to it.,pick someone's way.,tumble off the field.,0
pointed at his head.,back into his neck.,tucked under his rocks.,surrounding his firm hand.,0
helps his son up.,"stops his pace, then stops.",stands the last few steps in.,turns the lamp on.,3
stands the last few steps in.,"stops his pace, then stops.",helps his son up.,glides past the door.,3
leans over and kisses her.,rises to his feet.,wraps his arms around her.,remembers someone's uniform.,2
begin to play the pipes.,are playing the piano.,speak to the camera.,are playing with an iron.,2
play the piano together.,are playing the piano.,begin to play the pipes.,are playing with an iron.,0
cuts across the surface.,glances back at someone.,winks the balls on the floor.,holds up another attempt.,1
passes over her mouth.,rests into her forehead.,reaches into her forehead.,reaches out to her thigh.,0
flies over district 9.,passes to the ground.,rises from his arena.,rises over her perimeter.,0
see a man in boxing.,see gymnasts in am.,girl talks to the camera.,see the man talking again.,0
go to the lit room.,start back towards the beach.,get into his car.,walk along down the street.,3
gives him a wistful smile.,looks directly at it.,rises to greet him.,enters from the house.,0
drills a hole in a surfboard.,holds up a map.,lies asleep on his bed.,opens a pair of flowers.,0
cut through the darkness.,lie down the road.,put on on a display screen.,appear in her doorway.,0
embrace as they embrace.,sway on their feet.,stare at the river below.,fall into each other's arms.,1
stare at the river below.,embrace as they embrace.,share a slow kiss.,fall into each other's arms.,2
ceases as day breaks.,curls over her racket wings.,glows paint on their bundle.,is turned round again.,0
walks around to the table.,begins surfing the waves.,walks along the lake.,falls out of his water.,1
wait for the first chair.,begin to gag each other.,walk up to her.,turn and look away slowly.,3
enter a spiral ring.,"watch, water sprays.",stare directly at the sky.,stand on overcast sky.,2
"watch, water sprays.",stand on overcast sky.,enter a spiral ring.,reach a meeting room.,3
blots his face with a towel.,pulls on his fake rucksack.,lies on a sofa watching tv.,drapes a hand over his face.,0
looks around at the duct.,watches the video feed.,stands before the casket.,falls off the couch.,3
"watches her go, baffled.",takes off the bracelet.,is picked out for her late.,takes the kitten out.,0
ties him up and laughs.,kisses his lips wryly.,touches on his helmet.,"looks on, in stunned horror.",3
ties him up and laughs.,kicks his gun out of hand.,touches on his helmet.,kisses his lips wryly.,1
is singing on the phone.,has closed the door.,thrusts his horn furiously.,opens the chamber for vodka.,1
nods and looks down.,steps on the cross.,enters with a folder.,takes it from someone.,2
wait in the sky.,fly kites overhead in a sky.,are back in the sky watching.,walk up behind it.,3
slide down the blade.,fly in the air.,send up a frost diamond.,are in the bowl on his lap.,0
sits at his front.,gives someone a dark look.,is at the passenger cabin.,steps into the house.,1
writhes with agony.,drops to the floor.,bounces above the head.,hits it's nostrils.,1
hits it's nostrils.,slashes down his abdomen.,bounces above the head.,writhes with agony.,1
smiles and steps on.,heads into their office.,gazes adoringly at his wife.,steps into a pose.,3
turns back to his coworker.,holds up a phone receiver.,sags against a wall.,is in his early fifties.,2
spreads in the air.,hangs by the doors.,hangs from a small branch.,crashes to the ground.,3
smiles for her son.,stubs on the cigarette.,aims the swords at someone.,leads his boss away.,3
rests his mouth on her neck.,looks over his shoulder.,screws down the volume again.,lets out a whisper.,1
grins at the gould.,holds someone's hand.,puts the bat in his pocket.,walks in the door.,3
gets out and walks closer.,feels over the peg.,indicates at the door.,puts someone in a chokehold.,3
starts to play his saxophone.,starts to play hockey.,speaks and gives a thumbs up.,begins hitting the conga.,3
appears in the sky.,sets someone's feet nearby.,flies through the air.,appears on the screen.,3
"look down at him, seething.",seemed to be blown away.,look out into the night sky.,peers down at hogwarts.,0
stares at the screen.,finishes the back door.,turns and looks around.,stomps out of his way.,0
follows close to someone.,goes back to him.,slowly takes the telegram.,is desperate for someone.,1
slowly takes the telegram.,is desperate for someone.,has drawn himself up.,follows close to someone.,2
has completed his shot.,feels very proud by someone.,looks in her direction.,won't let her pass.,2
is holding a big saxophone.,is playing a violin slowly.,is peeling a piece of wood.,is holding a tattoo knife.,1
